text,timestamp,platform,username
"I'm so excited about this new project! Can't wait to share it with everyone.",2025-01-15T10:30:00Z,twitter,user1
"This is absolutely ridiculous. I can't believe they would do something like this.",2025-01-15T11:45:00Z,reddit,user2
"Feeling really down today. Nothing seems to be going right.",2025-01-15T12:15:00Z,instagram,user3
"You better watch out. There will be consequences for this action.",2025-01-15T13:20:00Z,twitter,user4
"Thanks for all the support everyone! You're the best community ever.",2025-01-15T14:30:00Z,reddit,user5
"Yeah right, like that's ever going to work. What a brilliant idea.",2025-01-15T15:45:00Z,twitter,user6
"I'm really worried about what might happen next. This makes me anxious.",2025-01-15T16:10:00Z,instagram,user7
"Love this new feature! It's exactly what we needed.",2025-01-15T17:25:00Z,github,user8
"I absolutely hate this new policy. It's the worst decision ever made.",2025-01-15T18:40:00Z,reddit,user9
"Here's some information about the upcoming meeting scheduled for tomorrow.",2025-01-15T19:55:00Z,twitter,user10
"This community is amazing! So grateful to be part of it.",2025-01-16T08:15:00Z,instagram,user11
"I'm furious about this situation. Someone needs to fix this immediately.",2025-01-16T09:30:00Z,reddit,user12
"Scared about the future. Don't know what's going to happen.",2025-01-16T10:45:00Z,twitter,user13
"You can do this! Believe in yourself and keep pushing forward.",2025-01-16T11:20:00Z,instagram,user14
"Oh wonderful, just what we needed. Another brilliant decision from management.",2025-01-16T12:35:00Z,reddit,user15
